{
  "command": "export",
  "schema_version": 1,
  "tool_versions": {
    "archway": "1.0.0-design",
    "dart_adapter": null,
    "typescript_adapter": null,
    "dart_sdk": null,
    "node": null,
    "typescript": null
  },
  "resolved_root": "/repo",
  "policy_path": "architecture.yaml",
  "policy_hash": "sha256:aaaaaaaaaaaaaaaaaaaaaaaaaaaaaaaaaaaaaaaaaaaaaaaaaaaaaaaaaaaaaaaa",
  "status": "ok",
  "exit_code": 0,
  "diagnostics": [
    {
      "code": "EMPTY_PLAN",
      "severity": "warning",
      "message": "empty plan",
      "rule_pointer": null,
      "source_range": null,
      "project_id": null,
      "path": null,
      "recovery_hints": []
    }
  ],
  "payload": {
    "format": "mermaid",
    "out": null
  }
}
